synced_at,export_enabled,title,title_zh,authors,year,source,doi,abstract,abstract_zh,topics,keywords,use_type,related_chapter,priority,reading_status,translation_status,derived_translation_status,processing_status,derived_processing_status,note,claim_supported,evaluation,block_count,comment_count,page_body_preview,has_page_body,has_comments,in_all_material_pack,in_literature_review_pack,in_theory_pack,notion_writeback_status,material_pack_status,url,notion_page_id
2026-06-26T19:01:35,是,"The link between perceived human resource management practices, engagement and employee behaviour: a moderated mediation model",感知人力资源管理实践、敬业度与员工行为之间的联系：一个有调节的中介模型,K. Alfes; A. D. Shantz; C. Truss; E. C. Soane,2013,The International Journal of Human Resource Management,10.1080/09585192.2012.679950,"This study contributes to our understanding of the mediating and moderating processes through which human resource management practices are linked with behavioural outcomes. We developed and tested a moderated mediation model linking perceived human resource management practices to organisational citizenship behaviour and turnover intentions. Drawing on social exchange theory, our model posits that the effect of perceived human resource management practices on both outcome variables is mediated by levels of employee engagement, while the relationship between employee engagement and both outcome variables is moderated by perceived organisational support and leader-member exchange. Overall, data from 297 employees in a service sector organisation in the UK support this model. This suggests that the enactment of positive behavioural outcomes, as a consequence of engagement, largely depends on the wider organisational climate and employees’ relationship with their line manager. Implications for practice and directions for future research are discussed.",本研究有助于深化我们对人力资源管理实践与行为结果之间中介和调节过程的理解。我们构建并检验了一个调节中介模型，将感知到的人力资源管理实践与组织公民行为和离职意向联系起来。基于社会交换理论，本模型认为，感知到的人力资源管理实践对这两个结果变量的影响由员工敬业度水平所中介，而员工敬业度与这两个结果变量之间的关系受到感知到的组织支持和领导—成员交换的调节。总体而言，来自英国一家服务业组织297名员工的数据支持了该模型。这表明，作为敬业度结果的积极行为结果的实施，在很大程度上取决于更广泛的组织氛围以及员工与其直线经理的关系。文中讨论了对实践的启示以及未来研究方向。,to-notion,,,,,,已翻译,已翻译,已从 Zotero 导入,已导出,,,,0,0,,False,False,True,False,False,skipped_existing_or_no_fields,generated,https://app.notion.com/p/The-link-between-perceived-human-resource-management-practices-engagement-and-employee-behaviour-a-38be8c8a654d815c8b72cca5fd0666fb,38be8c8a-654d-815c-8b72-cca5fd0666fb
2026-06-26T19:01:35,是,Allocative efficiency in public research funding: Can bibliometrics help?,公共研究资助中的配置效率：文献计量学能否提供帮助？,Giovanni Abramo; Ciriaco Andrea D’Angelo; Alessandro Caprasecca,2009,Research Policy,10.1016/j.respol.2008.11.001,"The use of outcome control modes of research evaluation exercises is ever more frequent. They are conceived as tools to stimulate increased levels of research productivity, and to guide choices in allocating components of government research budgets for publicly funded institutions. There are several contributions in the literature that compare the different methodological approaches that policy makers could adopt for these exercises, however the comparisons are limited to only a few disciplines. This work, examining the case of the whole of the “hard sciences” of the Italian academic system, makes a comparison between results obtained from peer review type of evaluations (as adopted by the Ministry of Universities and Research) and those possible from a bibliometric approach (as developed by the authors). The aim is to understand to what extent bibliometric methodology, which is noted as relatively inexpensive, time-saving and exhaustive, can complement and integrate peer review methodology in research evaluation.",研究评价活动中成果控制模式的使用日益频繁。它们被构想为旨在促进研究生产力水平提高，并指导公共资助机构政府研究预算组成部分配置选择的工具。文献中已有若干研究比较了政策制定者可在此类评价活动中采用的不同方法路径，然而这些比较仅限于少数学科。本文考察意大利学术体系中整个“硬科学”领域的案例，比较了同行评议式评价（如大学与研究部所采用）所得结果与文献计量方法（由作者开发）可能获得的结果。其目的在于理解文献计量方法在多大程度上能够补充并整合同行评议方法用于研究评价；该方法被认为相对低成本、省时且覆盖全面。,to-notion,,,,,,已翻译,已翻译,已从 Zotero 导入,已导出,,,,0,0,,False,False,True,False,False,skipped_existing_or_no_fields,generated,https://app.notion.com/p/Allocative-efficiency-in-public-research-funding-Can-bibliometrics-help-38be8c8a654d81ee87ecf054b8ee4a43,38be8c8a-654d-81ee-87ec-f054b8ee4a43
2026-06-26T19:01:35,是,"Consumer attitudes toward marketplace globalization: Structure, antecedents and consequences",消费者对市场全球化的态度：结构、前因与后果,Dana L. Alden; Jan-Benedict E.M. Steenkamp; Rajeev Batra,2006,International Journal of Research in Marketing,10.1016/j.ijresmar.2006.01.010,"This study examines relationships between a new measure of consumer attitudes toward consumption alternatives resulting from market globalization, several attitudinal antecedents (materialism, susceptibility to normative influence and consumer ethnocentrism), and a hypothesized consequence of these attitudes — preference for global brands. Following validation of the new measure in three culturally distinct markets, South Korea, the US, and China, the hypothesized antecedents and consequence are tested in South Korea. Empirical findings broadly support hypotheses and provide important implications for future research on market globalization.",本研究考察了一项衡量消费者对市场全球化所带来的消费替代选择之态度的新指标，与若干态度前因（物质主义、规范性影响易感性和消费者民族中心主义）以及这些态度的一个假设后果——对全球品牌的偏好——之间的关系。在韩国、美国和中国三个文化差异显著的市场中对该新指标进行验证后，研究在韩国检验了所假设的前因与后果。实证结果总体支持研究假设，并为未来关于市场全球化的研究提供了重要启示。,to-notion,,,,,,已翻译,已翻译,已从 Zotero 导入,已导出,,,,0,0,,False,False,True,False,False,skipped_existing_or_no_fields,generated,https://app.notion.com/p/Consumer-attitudes-toward-marketplace-globalization-Structure-antecedents-and-consequences-38be8c8a654d8181b104dba51bded1a6,38be8c8a-654d-8181-b104-dba51bded1a6
2026-06-26T19:01:35,是,The Brand Relationship Spectrum: The Key to the Brand Architecture Challenge,品牌关系谱系：品牌架构挑战的关键,David A. Aaker; Erich Joachimsthaler,2000,California Management Review,10.1177/000812560004200401,,,to-notion,,概念定义,研究方法,,,已翻译,部分已翻译,已从 Zotero 导入,已同步,,,,0,0,,False,False,True,False,False,skipped_existing_or_no_fields,generated,https://app.notion.com/p/The-Brand-Relationship-Spectrum-The-Key-to-the-Brand-Architecture-Challenge-38be8c8a654d81bc87b3c0d49f35522c,38be8c8a-654d-81bc-87b3-c0d49f35522c
2026-06-26T19:01:35,是,Measuring Brand Equity Across Products and Markets,跨产品与市场的品牌资产测量,David A. Aaker,1996,California Management Review,10.2307/41165845,,,to-notion,,机制解释,理论基础,,,已翻译,部分已翻译,已从 Zotero 导入,已同步,,,,0,0,,False,False,True,False,True,skipped_existing_or_no_fields,generated,https://app.notion.com/p/Measuring-Brand-Equity-Across-Products-and-Markets-38be8c8a654d81a2b11cf39eb2afaab8,38be8c8a-654d-81a2-b11c-f39eb2afaab8
2026-06-26T19:01:35,是,Leveraging the Corporate Brand,利用企业品牌,David A Aaker,,,,,,to-notion,,概念定义,文献综述,,,已翻译,部分已翻译,已从 Zotero 导入,已同步,,53535353,98765,3,1,"你好再见
as i was a child ,i would like to become a superstar.therefore, i only get a doll from my parents.",True,True,True,True,False,skipped_existing_or_no_fields,generated,https://app.notion.com/p/Leveraging-the-Corporate-Brand-38be8c8a654d815fbed4f3c2c82d9e0b,38be8c8a-654d-815f-bed4-f3c2c82d9e0b
